{"application":"Calculator","events":[{"request":"310961646409300930","response":"31096f6b0930"},{"request":"3109616464093230093232","response":"31096f6b093432"},{"request":"310961646409393232333337323033363835343737353830370930","response":"31096f6b0939323233333732303336383534373735383037"},{"request":"310961646409393232333337323033363835343737353830370931","response":"31096572726f72096f766572666c6f77"},{"request":"3109616464092d39323233333732303336383534373735383038092d31","response":"31096572726f72096f766572666c6f77"},{"request":"31097375627472616374092d370935","response":"31096f6b092d3132"},{"request":"31097375627472616374092d393232333337323033363835343737353830380931","response":"31096572726f72096f766572666c6f77"},{"request":"310973756274726163740939323233333732303336383534373735383037092d31","response":"31096572726f72096f766572666c6f77"},{"request":"31096d756c7469706c79092d360937","response":"31096f6b092d3432"},{"request":"31096d756c7469706c7909393232333337323033363835343737353830370932","response":"31096572726f72096f766572666c6f77"},{"request":"31096d756c7469706c79092d39323233333732303336383534373735383038092d31","response":"31096572726f72096f766572666c6f77"},{"request":"3109646976696465092d370933","response":"31096f6b092d32"},{"request":"31096469766964650937092d33","response":"31096f6b092d32"},{"request":"310964697669646509310930","response":"31096572726f72096469766973696f6e2d62792d7a65726f"},{"request":"3109646976696465092d39323233333732303336383534373735383038092d31","response":"31096572726f72096f766572666c6f77"},{"request":"","response":"31096572726f72096d616c666f726d65642d72657175657374"},{"request":"320961646409310932","response":"31096572726f7209756e737570706f727465642d76657273696f6e"},{"request":"31096d6f6409310932","response":"31096572726f7209756e6b6e6f776e2d6f7065726174696f6e"},{"request":"31096164640930310932","response":"31096572726f72096d616c666f726d65642d72657175657374"},{"request":"3109616464092b310932","response":"31096572726f72096d616c666f726d65642d72657175657374"},{"request":"31096164640931","response":"31096572726f72096d616c666f726d65642d72657175657374"},{"request":"ff","response":"31096572726f72096d616c666f726d65642d72657175657374"}],"recordedFrom":{"guest":{"blake3":"2adca3e7ca42d7415a5227a20002baad90047d087249cbb9ea36e557f5a4a380","sha256":"dcf53677c7c80636f8fc2247676b8f747d1549ce4af742c8505eb0f0ae334c03"},"model":{"blake3":"e76544838a98c46341ed8807f72897ec68de5a8a9bf28721738a76761c9df90e","sha256":"074921890f5c372c89f4ed794d26dd550231d5e9bf99bf9474cc1a78923292c6"}},"schema":"prism/history/1"}
