{"application":"PaymentApproval","events":[{"request":"636c65726b093235300931303030","response":"617070726f766564"},{"request":"636c65726b09313030300931303030","response":"617070726f766564"},{"request":"6d616e6167657209353030300931303030","response":"617070726f766564"},{"request":"6d616e6167657209393232333337323033363835343737353830370930","response":"617070726f766564"},{"request":"636c65726b09313030310931303030","response":"72656675736564"},{"request":"636c65726b09310930","response":"72656675736564"},{"request":"6d616e6167657209300931303030","response":"696e76616c6964"},{"request":"636c65726b092d350931303030","response":"696e76616c6964"},{"request":"636c65726b0930350931303030","response":"696e76616c6964"},{"request":"636c65726b09393232333337323033363835343737353830380931303030","response":"696e76616c6964"},{"request":"636c65726b0931303030092d31","response":"696e76616c6964"},{"request":"61756469746f720931300931303030","response":"696e76616c6964"},{"request":"636c65726b093130","response":"696e76616c6964"},{"request":"636c65726b093130093130303009","response":"696e76616c6964"},{"request":"","response":"696e76616c6964"},{"request":"ff","response":"696e76616c6964"},{"request":"6d616e61676572093109393939393939393939393939393939393939393939393939393939393939393939393939393939393939393939393939393939393939","response":"696e76616c6964"},{"request":"6d616e6167657209310939393939393939393939393939393939393939393939393939393939393939393939393939393939393939393939393939393939393939","response":"696e76616c6964"},{"request":"636c65726b093131313131313131313131313131313131313131313131313131313131313131313131313131313131313131313131313131313131313131313131313131313131313131313131313131313131313131313131313131313131313131313131313131313131313131313131313131313131313131313131313131","response":"696e76616c6964"}],"recordedFrom":{"guest":{"blake3":"0b5bbdb716fa46ca83096e030bb3e18207b2bc4bc53759584e2c9fe9b4cbf4a9","sha256":"eda626117adae723fac5ffb6c957717c251cf2c3c15773c817c39a7968aec92f"},"model":{"blake3":"1d58417a40cca4108f9778a79636b827c400c814182ae490509d6a83246324e6","sha256":"f38874cc1348c56e83d6d4afa0e8612552aebac0c1efa467b7a1f9d117e8343c"}},"schema":"prism/history/1"}
